{
  "version": "1.0.0",
  "factors": {
    "SMALL": {
      "factor": 1.4249999999999998,
      "samples": 3,
      "confidence": 0.7737056144690831,
      "last_updated": "2025-12-19T13:45:43.147357Z"
    },
    "LARGE": {
      "factor": 0.6923076923076923,
      "samples": 1,
      "confidence": 0.3868528072345416,
      "last_updated": "2025-12-19T14:22:55.725594Z"
    }
  },
  "global": {
    "total_samples": 4,
    "overall_accuracy": 0.6101923076923077,
    "trend": "improving"
  },
  "history": [
    {
      "feature_slug": "test-debug-feature",
      "complexity": "SMALL",
      "estimated": 30.0,
      "actual": 45.0,
      "ratio": 1.5,
      "timestamp": "2025-12-19T13:45:43.144975Z"
    },
    {
      "feature_slug": "calibration-test-feature",
      "complexity": "SMALL",
      "estimated": 30.0,
      "actual": 45.0,
      "ratio": 1.5,
      "timestamp": "2025-12-19T13:45:43.145529Z"
    },
    {
      "feature_slug": "runner-test-feature",
      "complexity": "SMALL",
      "estimated": 20.0,
      "actual": 25.0,
      "ratio": 1.25,
      "timestamp": "2025-12-19T13:45:43.147357Z"
    },
    {
      "feature_slug": "f07-orchestration-multi-agents",
      "complexity": "LARGE",
      "estimated": 260.0,
      "actual": 180.0,
      "ratio": 0.6923076923076923,
      "timestamp": "2025-12-19T14:22:55.725594Z"
    }
  ],
  "updated_at": "2025-12-19T14:22:55.726062Z"
}